Nama Perusahaan,Alamat,Kawasan/Kecamatan
PT.,"BUMIMULIA, INDAH, LESTARI, Kawasan Industri Jababeka,, ~Jl. Jababeka No. XVI Kav. 65, A, ~Bekasi 17750, 200, -, 1573",Jababeka
PT.,"BUMIMULIA, INDAH, LESTARI, Kawasan Industri Jababeka,, ~Jl. Jababeka No. XVI Kav. 65, A, ~Bekasi 17750, 300, 3, 1574",Jababeka
PT.,"BUMIMULIA, INDAH, LESTARI, Kawasan Industri Jababeka,, ~Jl. Jababeka No. XVI Kav. 65, A, ~Bekasi 17750, 200, 3, 1575",Jababeka
PT.,"BUMIMULIA, INDAH, LESTARI, Kawasan Industri Jababeka,, ~Jl. Jababeka No. XVI Kav. 65, A, ~Bekasi 17750, 300, 4, 1576",Jababeka
PT.,"BUMIMULIA, INDAH, LESTARI, Kawasan Industri Jababeka,, ~Jl. Jababeka No. XVI Kav. 65, A, ~Bekasi 17750, 100, -, 1577",Jababeka
PT.,"MENARA, TERUS, MAKMUR, Kawasan Industri Jababeka,, Cikarang, Jl. Jababeka XI, Blok, H-3, No. 12, 100, -, 1578, PT., MENARA, TERUS, MAKMUR, Kawasan Industri Jababeka,, Cikarang, Jl. Jababeka XI, Blok, H-3, No. 12, 100, 2, 1579, PT., MENARA, TERUS, MAKMUR, Kawasan Industri Jababeka,, Cikarang, Jl. Jababeka XI, Blok, H-3, No. 12, 200, 2, 1580, PT., BINA, NIAGA, MULTIUSAHA, Kawasan Industri Jababeka, Jl., Industri Selatan 4 blok PP No., 4,, Desa, Pasirsari,, Kec., Cikarang Selatan, 200, 4, 1581, PT., BINA, NIAGA, MULTIUSAHA, Kawasan Industri Jababeka, Jl., Industri Selatan 4 blok PP No., 4,, Desa, Pasirsari,, Kec., Cikarang Selatan, 200, 4, 1582, PT. BERNADI UTAMA, Kawasan, Jababeka,, Jl., Jababeka II Blok C No. 26,, Desa, Pasirgombong,, Kecamatan Cikarang Utara,, Kabupaten Bekasi, 200, 4, 1583, PT., SARANA, CHROME, PERSADA, Kawasan Industri Jababeka, Jl., Jababeka XVII E Blok U No. 25, B-C,, 100, -, 1584, PT. BIOTEK INDONESIA, Kawasan, Industri, Lippo, Cikarang, Jl. M.H. Thamrin Blok, A-10 No. 3, Delta Silicon, Industrial Park, Lippo Cikarang,, Bekasi, 100, -, , , R A H A S I A, , , R A H A S I A, 227, , 1, 2, 3, 4, 5, 1585, PT. SURYA LESTARI SINAR, MAKMUR, Kawasan, Industri, Lippo, Cikarang, Jl. Palem I Blok DS, No. 1 Boston Techno Park,, Desa, Cibatu,, Kecamatan, Cikarang Selatan,, 100, 2, 1586, PT. TRIMITRA CIKARANG, Kawasan, Industri, Lippo, CIkarang, Jl. Waru Blok F2-006,, Delta Silicon II, 300, 3, 1587, PT. ARTA ABADI, Kawasan, Industri, Lippo, Cikarang,~Jl. Akasia II Kav.A 5-, 9, Ds. SukaresmiKec.Cikarang, Selatan, Kab. Bekasi, 100, 2",Jababeka
PT. ARTA ABADI,"Kawasan, Industri, Lippo, Cikarang,~Jl. Akasia II Kav.A 5-, 9,, Ds., Sukaresmi,~Kec.Cikarang, Selatan, Kab. Bekasi",Bekasi
PT. SAURINDOTEX MANDIRI,"Kawasan Industri Lippo City, Cikarang City Blok J5-6, 18, Newton Techno Park Lippo, 200, 4, 1590, PT., SURYASUKSES, ADI, PERKASA, Kawasan MM 2100,~Jl. Selayar, Blok, B3-1,~Mekarwangi,, Cikarang Barat,~Bekasi,, 300",MM2100
PT. SETIA GUNA SEJATI,"Kawasan Industri MM2100  Jl., Irian Blok HH-3 Desa Jatiwangi,, Kec. Cikarang Barat, 200, 3, 1592, PT., NUSAHADI, CITRAHARMONIS, Kawasan Industri MM2100, Jl., Halmahera Blok DD-4, Cibitung, 300, 3, 1593, PT., DIAMOND, COLD, STORAGE, Kawasan Industri MM2100, Jl., Halmahera Blok EE-2, Cibitung,, Cikarang Barat, 200, 2, 1594, PT., DIAMOND, COLD, STORAGE, Kawasan Industri MM2100, Jl., Halmahera Blok EE-2, Cibitung,, Cikarang Barat, 100, -, 1595, PT., DIAMOND, COLD, STORAGE, Kawasan Industri MM2100, Jl., Halmahera Blok EE-2, Cibitung,, Cikarang Barat, 200, -, 1596, PT., DIAMOND, COLD, STORAGE, Kawasan Industri MM2100, Jl., Halmahera Blok EE-2, Cibitung,, Cikarang Barat, 800, 9, 1597, PT. SUKANDA DJAYA, Kawasan Industri MM2100, Jl., Irian Blok FF-2, Cibitung Kab., Bekasi, 200, 1, 1598, PT. TIRTA ALAM SEGAR, Kawasan Industri MM2100, Jl., Kalimantan Blok B1-2 Desa, Gandamekar, Kec. Cikarang, Barat, 200, -, 1599, PT. TIRTA ALAM SEGAR, Kawasan Industri MM2100, Jl., Kalimantan Blok B1-2 Desa, Gandamekar, Kec. Cikarang, Barat, 100, -, 1570, PT. TIRTA ALAM SEGAR, Kawasan Industri MM2100, Jl., Kalimantan Blok B1-2 Desa, Gandamekar, Kec. Cikarang, Barat, 100, -, 1571, PT. ADVANCE STABILINDO, INDUSTRY, Kawasan Industri MM2100, Jl., Sulawesi, III, Blok, M-29,, Cikarang Barat, Bekasi, 100, -, , , R A H A S I A, , , R A H A S I A, 228, , 1, 2, 3, 4, 5, 1572, PT. ADVANCE STABILINDO, INDUSTRY, Kawasan Industri MM2100, Jl., Sulawesi, III, Blok, M-29,, Cikarang Barat,, 200, 2, 1573, PT., BUMIPUTRA, MANUFAKTUR TEKNOLOGI, Kawasan, Industri, MM2100,, Jl.Selayar Blok C1 No. 19,, Desa Mekarwangi, Kecamatan, Cikarang Barat, 100, 2, 1574, PT., BUMIPUTRA, MANUFAKTUR TEKNOLOGI, Kawasan, Industri, MM2100,, Jl.Selayar Blok C1 No. 19,, Desa Mekarwangi, Kecamatan, Cikarang Barat, 200, -, 1575, PT. REXPLAST, Kawasan Industri PIER, Jl., Berbek Industri V/10 Waru,, Sidoarjo, 200, 2, 1576",MM2100
PT. KOSTEC INDONESIA,"Kawasan, Jababeka, I,, Jl., Jababeka IX Blok K No.4D,, Cikarang, 200, -, 1577, PT. KOSTEC INDONESIA, Kawasan, Jababeka, I,, Jl., Jababeka IX Blok K No.4D,, Cikarang, 100, 2, 1578, PT. BEVANANDA MUSTIKA, Kawasan Lippo Cikarang Blok, J5 No. 12 Newton Park,, Lemahabang, 100, 1, 1579, PT. BEVANANDA MUSTIKA, Kawasan Lippo Cikarang Blok, J5 No. 12 Newton Park,, Lemahabang, 200, 2, 1580, PT. TOP PLASTS, Kawasan Marunda Center Blok, B 18 dan 40, RT. 06/RW. 06, Desa, Segaramakmur, Kec., Tarumajaya",Jababeka
PT. GLOPAC INDONESIA,"Kawasan Newton Technopark,, Jl. Jati 5 Blok J4 No. 3 Lippo, Cikarang,, Desa, Serang,, Kecamatan Cikarang Selatan, 200, 2, 1582, PT., BERKAT, AGRO, NUSANTARA, Komplek Batik Kav. 10, Desa, Mekarwangi,, Kecamatan, Cikarang Barat, 300, 2, 1583, PT. INTAN ANGKASA AIR, SERVICE, Komplek Industri KIMU Jl. Pintu, Gerbang Tol Cibitung, Desa, Gandasari, Bekasi-17520, Jawa, Barat, 200, , 1584, PT., KARYA, BAHANA, BERLIAN, Komplek Pertokoan ""Pulo Mas"", Blok III Kav. 3-4 Jakarta 13260, 200, 2, 1585",Cikarang Barat
PT.,"KARYA, BAHANA, BERLIAN, Komplek Pertokoan ""Pulo Mas"", Blok III Kav. 3-4 Jakarta 13260, 100, -, 1586",Lainnya
PT.,"KARYA, BAHANA, BERLIAN, Komplek Pertokoan ""Pulo Mas"", Blok III Kav. 3-4 Jakarta 13260, 200, 1, 1587",Lainnya
PT. JAGAD KARIMBANUSA,"Kompleks, Ketapang, Indah, B2/22 Jl. KH. Zainul Arifin 14-20, Jakarta, 100, -, 1588",Lainnya
PT. SAKA INDAH ABADI,"Kp. Cikedokan RT.005 RW.009,, Desa Sukadanau, Kecamatan, Cikarang, Barat,, Kabupaten, Bekasi, 200, 1, 1589, PT., SARANAPRIMA, NUSANTARA ABADI, Kp. Cikendokan RT. 05/RW., 12,~Ds. Sukadanau, Cikarang, Barat~Bekasi, 300, 2",Bekasi
PT. WIRA MUSTIKA ABADI,"Kp. Jarakosta RT. 003/RW., 002, Ds. Sukadanau, Kec., Cikarang Barat,, 300, 2",Cikarang Barat
PT. DIBLESTARI DJAUHARI,"Kp. Kedung Rawa No. 280 Rt., 08/01 Setia Mekar, Tambun, 400, 3, 1582, PT.",Tambun
PT. GUNUNG GARUDA,"Kp. Tangsi, RT. 003/RW. 003,, Sukadanau, Cikarang Barat,, 200, -, 1584",Cikarang Barat
PT. GUNUNG GARUDA,"Kp. Tangsi, RT. 003/RW. 003,, Sukadanau, Cikarang Barat,, 100, -, 1585",Cikarang Barat
PT.,"DUMA, ALBUM, INTERNATIONAL, Kp. Telajung RT. 001/08 No. 70, Desa Telajung, Kec. Cikarang, BaratRT. 001/RW. 08 No.70, 100, 1",Lainnya
PT.,"YOSILINDO, ANEKA, COKELAT INDUSTRI, Mangga Dua Plaza Blok B No., 7 Jl. Mangga Dua Raya, 200, 1, 1587, PT. KAWASAN INDUSTRI, JABABEKA, Menara Batavia, Lantai 25 Jl., K.H. Mas Mansyur Kav. 126, 100, 1, 1588, PT. KAWASAN INDUSTRI, JABABEKA, Menara Batavia, Lantai 25 Jl., K.H. Mas Mansyur Kav. 126, 100, 1, 1589, PT. KAWASAN INDUSTRI, JABABEKA, Menara Batavia, Lantai 25 Jl., K.H. Mas Mansyur Kav. 126, 100, 1, 1590, PT. CITRA BUANA BETON, PERKASA, Menara Bumi Daya Plaza Lt., 25, Jl. Imam Bonjol No. 61,, Jakarta Pusat, 100, 1, 1591, PT. CITRA BUANA BETON, PERKASA, Menara Bumi Daya Plaza Lt., 25, Jl. Imam Bonjol No. 61,, Jakarta Pusat, 100, 1, 1592, PT., MAKANAN, SEHAT, NUSANTARA, Menara Hijau Lt. 6, Jl. MT., Haryono Kav. 33 Kel. Cikoko,, Kecamatan Pancoran, Jakarta, Selatan 12770, 100, 2, 1593, PT. CIPTA MORTAR UTAMA, Menara Sudirman Lantai 11,, Jalan Jend. Sudirman Kav. 60,, Jakarta Selatan 12190, 200, 1, 1594, PT., WILMAR, CAHAYA, Indonesia Tbk, Multivision Tower, Lt. 12, Jl., Kuningan, Mulya, Kav., 9B,, Guntur Setiabudi, 100, -, 1595, PT. MALINDO IRFAN, Newton Techno Park Lippo, Cikarang, Jl. Jati V Blok J-5 / 1,, 100, 3, 1596, PT. MALINDO IRFAN",Jababeka
PT.,"SINAR, MAS, AGRO, RESOURCES, &amp;, TECHNOLOGY, TBK., (PT., SMART TBK.)",Lainnya
PT. GT UTAMA GARMENTS,"Plaza GRI Lantai 18 Jl. HR., Rasuna Said Blok X-2 No. 1, 100, 2, 1599, PT., INDOFOOD, SUKSES, MAKMUR TBK., Plaza Indofood Tower Lantai, 27,~Gedung, Sudirman, Plaza,~Jl. Jend. Sudirman Kav., 76-78, 200",Lainnya
PT.,"INDOFOOD, SUKSES, MAKMUR TBK., Plaza Indofood Tower Lantai, 27,~Gedung, Sudirman, Plaza,~Jl. Jend. Sudirman Kav., 76-78, 200",Lainnya
PT.,"LAZUARDI, RUKUN, PERKASA, Rukan Plaza Sunter Terrace, Blok. C8 Jl. Danau Sunter Utara, L60, Kelurahan Sunter Agung,, Kecamatan, Tanjung, Priok,, Jakarta Utara, 300, 4, 1603, PT. DALZON CHEMICALS, INDONESIA, Ruko Cempaka Mas Blok K No., 22, Sumur Batu, Kemayoran,, 200, 2, 1604, PT., ALTIKAMURNI, INTERNUSA, Ruko Kemang Pratama, Jl., Duta I, Blok MM32,, 200, 3, 1605, PT., ALTIKAMURNI, INTERNUSA, Ruko Kemang Pratama, Jl., Duta I, Blok MM32,, 200, 3, 1606, PT. SISTEM JENDELAINDO, Ruko Palazzo, Jl. Benyamin, Syueb Blok B Unit A.21,, Kelurahan, Kebon, Kosong,, Kecamatan Kemayoran, 300, 4, 1607, PT., HOWEZEN, INDAH, INDUSTRY, Ruko Vila Gading Indah Blok, A2/A3, Jl. Boulevard Bukit, Gading Raya, Kel. Kelapa, Gading, Barat,, Kecamatan",Lainnya
PT.,"SINAR, RAFLESIA, SELATAN, Sentra Bisnis Harapan Indah, Blok SN No. 18, Kelurahan, Pejuang, Kecamatan Medan, Satria, Kota Bekasi, Provinsi, Jawa Barat, 100, -, 1609, PT., TRANS, RETAIL, INDONESIA, Sunset Road Kota Denpasar,, Provinsi Bali.Carrefour Lebak, Bulus, Lantai 3, Jl. Lebak Bulus, Raya No. 8, Kel. Pondok, Pinang, Kec. Kebayoran Lama, 200, 4, 1610, PT., TRANS, RETAIL, INDONESIA, Sunset Road Kota Denpasar,, Provinsi Bali.Carrefour Lebak, Bulus, Lantai 3, Jl. Lebak Bulus, Raya No. 8, Kel. Pondok, Pinang, Kec. Kebayoran Lama, 200, -, 1611, PT. DUTA HITA JAYA, Taman Pegangsaan Indah Blok, A No. 3-5, Jl. Pegangsaan Dua,, Kelapa Gading, 300, 3, 1612, PT. INNI HARMONY JAYA, Taman Sentosa Blok G3, No. 6,, RT. 028/RW. 007, Pasirsari,, Cikarang Selatan, 200, 3, 1613",Cikarang Selatan
PT. WAHANA MATRASEJATI,"Tara Building Jl. KH. Hasyim, Ashari No. 37 A JAKARTA, 300, 4, 1614, PT., FAJARGEMILANG, SAPUTRA, Villa Batik, Lippo City Blok H-, Lemah Abang, 100, -, 1615, PT., INDOALUMINIUM, INTIKARSA INDUSTRI, Wisma  Indocement Lt.16, Jl., Jend., Sudirman, Kav.70-71,, Jakarta Selatan, 100, -, 1616, PT., BEKASI, FAJAR, INDUSTRIAL ESTATE TBK., Wisma Argo Manunggal Lantai, 10,~Jl. Jend. Gatot Subroto, Kav. 22, RT 003/RW 002,~Kel., Karet Semanggi, Kec. Setiabudi, 100, 2",Bekasi
PT.,"BEKASI, FAJAR, INDUSTRIAL ESTATE TBK., Wisma Argo Manunggal Lantai, 10,~Jl. Jend. Gatot Subroto, Kav. 22, RT 003/RW 002,~Kel., Karet Semanggi, Kec. Setiabudi, 200, 2",Bekasi
PT. BAKRIE CORRUGATED,"METAL INDUSTRY, Wisma Bakrie Lt IV Jl. HR., Rasuna Said Kav. B-1, 200, 4, 1619, PT., HARBOUR, RING, DHARMALA, Wisma Dharmala Sakti, Lt. 16, Jl. Jend. Sudirman kav. 32,, Jakarta 10220, 200, 4, 1620, PT. PIONIRBETON INDUSTRI, Wisma Indocement Lantai 15,, Jl. Jend. Sudirman Kav. 70-71., 200, 4, 1621, PT., SWASTHI, PARAMA, MULYA, Wisma Indocement, Lantai 6, Jl., Jenderal Sudirman Kav. 70-71,, Jakarta, 100, -, 1622, PT. KARTIKA SASANA BOGA, Wisma Intan JL. Matraman, Raya 134 Jakarta 13150, 100, -, 1623, PT., METRODATA, ELECTRONICS, Wisma Metropolitan I Lt. 16 Jl., Jend. Sudirman Kav. 29-31., JAKARTA - SELATAN, 100, 2, 1624, PT. MULIAGLASS, Wisma Mulia Lantai 53, ~Jl., Jenderal Gatot Subroto No. 42,, ~Kuningan Barat, Mampang, Prapatan, 300",Lainnya
PT. MULIAGLASS,"Wisma Mulia Lantai 53, ~Jl., Jenderal Gatot Subroto No. 42,, ~Kuningan Barat, Mampang, Prapatan, 100",Lainnya
PT.,"MULIAKERAMIK, INDAHRAYA, Wisma Mulia Lantai 53, Jl., Jenderal Gatot Subroto No.42, 300, 1, 1627, PT., MULIAKERAMIK, INDAHRAYA, Wisma Mulia La1629ntai 53, Jl., Jenderal Gatot Subroto No.42, 200, 4, 1628, PT., MULIAKERAMIK, INDAHRAYA, Wisma Mulia Lantai 53, Jl., Jenderal Gatot Subroto No.42, 300, -, 1629, PT. BIOLINA TRIO SINTESA, Wisma, Standard, Chartered, Bank, Lt. 17 Jl. Jend. Sudirman, Kav. 33A, 200, 3, 1630, PT., RISJAD, BRASALI, PEROXIDA, World Trade Centre 12th Floor, Jl. Jend. Sudirman 29-31, 300, 3, 1631, PT. CIKARANG LISTRINDO, World Trade Centre, Lantai 17,, Jl. Jend. Sudirman Kav. 29-31,, Kelurahan Karet, Kecamatan, Setiabudi, 200, 2, 1632, PT. CIKARANG LISTRINDO, World Trade Centre, Lantai 17,, Jl. Jend. Sudirman Kav. 29-, 31,Kelurahan Karet, Kecamatan, Setiabudi, 100, -, 1633, PT. CIKARANG LISTRINDO, World Trade Centre, Lantai, 17,Jl. Jend. Sudirman Kav. 29-, 31,, Kelurahan, Karet,, Kecamatan Setiabudi, 200, -, 1634, PT., GEMA, ANEKATOYS, INDONESIA, Wsiata Hotel Int Tower Lt. 3 Jl., MH. Thamrin Jakarta Pusat, 800, 9, 1635, PT., JABABEKA, INFRASTRUKTUR, WTC LT 12 JEND SUDIRMAN, KAV 29-31 JKT, 200, 1, 1636, PT. ALSYNITE INDONESIA, Kawasan Industri Hyundai, Jl., Inti Raya Blok C 4 No. 2-3, Kel., Sukaresmi,, Kec., Cikarang, Selatan, Bekasi, 200, -, , , R A H A S I A, , , R A H A S I A, 232, , 1, 2, 3, 4, 5, 1637, Perusahaan Perorangan PD., SUMBER JAYA LESTARI, Jl. Raya Inspeksi Kalimalang, RT.003/005,, Kelurahan, Jatimulya, Kecamatan Tambun, Selatan, 100",Jababeka
PT.,"DE, GLOW, INTERNATIONAL, Kawasan Industri Jababeka II,, Jl. Industri Utama Raya Blok, RR, 2F,, Desa, Pasirsari,, Kecamatan Cikarang Selatan, 100, -, 1639, PT., GRAFITECINDO, CIPTAPRIMA, Jl. Jababeka V Blok V, Kav. 92-, 93, Desa Karang Baru, Kec., Cikarang Utara, 100, -, 1640, PT., SUPRA, SUKSES, TRINUSA, Jl. Jababeka VI B Blok J No. 7, E Kawasan Industri Jababeka, Cikarang, Desa Harjamekar., Kecamatan Cikarang Utara, 200, 2, 1641, PT. UNION METAL, Jl. Jababeka V Blok U No. 1,, Kawasan Industri Jababeka I,, Kel., Harja, Mekar,, Kec., Cikarang Utara, 100, 2, 1642, PT. HARAPAN WIDYATAMA, PERTIWI, Jl. Agung Raya V Blok B, No. 8-, 9, Sunter Agung Podomoro,, Papango, 200, -, 1643, PT. NUTRIFOOD INDONESIA, Jl. Rawabali II No. 3, Kawasan, Industri Pulogadung, Jakarta, 200, 2, 1644, PT., PASADENA, METRIC, INDONESIA, Wisma Bumiputera 10th floor,, Jl. Jend. Sudirman Kav. 75, Jakarta, 200, -, 1645, PT. TESSO TETRA CHEMIKA, Jl. Industri Selatan 2 Blok JJ, No. 4  Kawasan Industri, Jababeka, Cikarang,Desa, Pasirsari, Kecamatan Cikarang, Selatan, 100, 2, 1646, PT., SPECTRA, KIMIA, KENCANA, Komplek Ruko Buncitmas Jl., Kemang Utara IX Blok CC 5, RT.002/001, Kelurahan Duren, Tiga, Kecamatan Pancoran, 100, 1, 1647",Jababeka
PT.,"GRAHA, KERINDO, UTAMA, Jl. Kerajinan No. 3-7, Kel., Krukut, Kec. Taman Sari, 200, 2, 1648, PT. HULARO INDONESIA, Jl. Jababeka IXD Blok P-3,, Kawasan Industri Jababeka, 100, 2, 1649, PT., KHARISMA, MUSTIKA, MEGASARI, Jl. Arjuna No. 37, RT. 11/RW., 99, Kel. Kemanggisan, Kec., Palmerah, 200, 2",Jababeka
PT.,"ADYAWINSA, ELECTRICAL AND POWER, Jl. Industri Selatan Blok LL 4, Kwsn Jababeka Cikarang,Desa, Pasirsari, Kec Cikarang Selatan, 300, 2, 1651, PT. KATI KARTIKA MURNI, Jl. Imam Bonjol No. 76, Kel., Panunggangan, Barat,, Kec., Cibodas, 200, , 1652, PT., SARANA, UNGGUL, PRATAMA, Jl. Gaharu Blok 5 No. 11 H, Delta Silicon II Industrial Park, Lippo Cikarang, Desa Cibatu,, Kecamatan Cikarang Selatan,, 200, 2, 1653, PT., CITRA, NUSANTARA, GEMILANG, Jl. Kalimalang No. 126 Tegal, Gede, RT. 004/RW. 003,  Desa, Pasirsari, Kecamatan Cikarang, Selatan, Bekasi, 100, -",Jababeka
PT.,"BUANA, SAMUDRA, LESTARI, Jl. Raya Bosih Kp. Tanah, Merdeka, RT.007, RW.005,, Kelurahan, Wanasari,, Kecamatan Cibitung, 200, 1, 1655, PT. DIFAN PRIMA PAINT, Jl. Griya Utama Blok A No. 101,, Kelurahan, Sunter, Agung,, Kecamatan, Tanjung, Priok,, Jakarta Utara, 100, -, 1656, Perusahaan, Perorangan, PURNAMA, Kp. Tangsi RT. 003 RW. 003,, Desa Sukadanau, Kecamatan, Cikarang Barat, 200, 1, 1657, PT., RAPHAELINDO, NUSANTARA, Jl. Karya Logam RT. 005 RW., 005,, Kelurahan, Jatimulya,, Kecamatan Tambun Selatan,, Kabupaten Bekasi, 300, 2, 1658, PT., TOLLING, MANUFACTURE INDUSTRI, Jl. Industri Selatan 2 Blok JJ, No., 4, Kawasan, Industri, Jababeka, Cikarang,Desa, Pasirsari, Kecamatan Cikarang, Selatan, 300, 2, 1659, PT. DHARMA ELECTRINDO, MANUFACTURING, Jl. Jababeka XII Blok W, No. 5, A, Cikarang, 400, 3, 1660, PT., GLOBAL, DIMENSI, METALINDO, Kawasan Industri Jababeka 1,, Jl. Jababeka XVII B, Blok U No., 19 C,D,E dan F, 300, 6, 1661, PT., IMPACK, PRATAMA, INDUSTRI, Jl. Yos Sudarso Kav. 85, Sunter, Jakarta Utara, 200, -, 1662, PT., OMEGA, TAIYO, TEKNOLOGI, Ruko Cikarang Square Blok F,, Desa, Pasirsari, Cikarang, Selatan, 100, -, 1663, PT. DUNIA KIMIA JAYA, Kawasan Industri Greenland, Cluster Batavia Blok BD No. 1, Kota, Deltamas,, Desa, Sukamahi,, Kecamatan, Cikarang, Pusat,, Kabupaten, Bekasi, 100, 2, 1664, PT., HIKARI, METALINDO, PRATAMA, Jl. Raya Serang Cibarusah RT., 01/RW.02, Kp. Pagaulan, Desa, Sukaresmi, Cikarang Selatan, 200, 2, 1665",Jababeka
PT.,"MULIAKERAMIK, INDAHRAYA, Wisma Mulia Lantai 53, Jl., Jenderal Gatot Subroto No.42, 500, 9, 1667, PT., MULTIKIMIA, INTIPELANGI, Kampung Mariuk RT. 02/RW., 02,, Desa, Ganda, Mekar,",Lainnya
PT.,"YASUNLI, CITRA, INDONESIA, Jl. Akasia II Blok A-9 No. 3 A, Delta Silicon Industrial Park, Lippo, Cikarang,, Desa, Sukaresmi,, Kecamatan, Cikarang Selatan, Kabupaten, Bekasi, 200, 2, , , , , , , , /. 4. PERTAMBANGAN ……",Delta Silicon
PT. Bina Loka Cipta,"Jln. Gatot Subroto No. 49-, 50 Cikarang Utara Kab, Bekasi 021-8900641, , 3., SPPBE, Kp., Cigutul, Desa, Sindangmulya, , 4., SPBE/YUSUF, Desa Lubang Buaya Kec., Setu, , 5.",Cikarang Utara
PT. Gasindo,"Jaya Pratama, Jl. Raya H. Bosih Kel., Wanasari Kec. Cibitung, , , c., Pembangkit Listrik, , NO, NAMA, ALAMAT / NO. TLP, KET., 1, 2, 3",Cibitung
PT. Bekasi Sejati Gas,"Kp. Sasak Jarang RT 01/01, Kel Jatimulya Kec. Tambun, Selatan Kab. Bekasi., 021-, 8812507",Tambun
PT. Bhakti Persada Gas,"Rapidin Simbolon, Jl. Raya Pondok Timur, Indah Kp. Rawa Sapi RT, 01/10 Kel Jatimulya Kec., Tambun Selatan, 021, –, 82608448",Tambun
CV. Mulya Cipta Pratama,"Kp. Legon RT 03/04 Kel, Jatimulya, Kec., Tambun, Selatan Kab. Bekasi.",Tambun
PT.,"Prima, Gas, Nyala, Sempurna, Jl. Raya Rawa Kalong RT, 02/03 Desa Karang Satria, Kec. Tambun Utara Kab., Bekasi., 021, –",Tambun
PT. Kamal Reka Jaya,"Jl. Ray Afatahilah no. 6 ds., Kalijaya kec. Cikarnag Barat, , 44., ABDUL AZIS, Jl. Cendrawasih II No. 26, Ds. Telaga Murni Kec., Cikarang Barat, , 45., IGAS UTAMA, Kawasan Industri MM2100, Ds., Gandasari, Kec., Cikarang Barat, , 46., PT. HAYATI  HANA, DIMYATI (Bambang rawan), Kp. Ketapang ds. Kalijaya, Kec. Cikarang Barat, , , g., Pengrajin Batu Permata, , NO, NAMA, ALAMAT / NO. TLP, KET., , NIHIL",MM2100
CV. 3T,"Kp. Kobak Pasir Rt.03/03 Ds., Sukalaksana Kec. Sukakarya, , 12., CV. 3T",Lainnya
CV. Berkah Group,"Kp. Rawakeladi Rt.02/02 Ds., Sukaindah Kec. Sukakarya, , 14., CV. Berkah Group",Lainnya
PT. BERDIKARI Persero,"(ANDINI), , Jl.  Andini Sakti Kp. Poncol, Rt.01/03, Ds., Gandasari, Kec. Cikarang Barat, SAPI",Cikarang Barat
PT. Karya Gita Utama,"Kp. Kedungkole Rt. 05/02, Ds., Karangmekar, Kec., Kedungwaringin",Lainnya
PT. Gemilang Gaisindo,"Bhakti, ., Jl. Raya Sukatani Kp., Blokang Rt. 02 / 01 Desa, Kr. Sentosa Kec. Kr., Bahagia Kab. Bekasi, , 2.",Bekasi
PT. Inahovtraco,", Jl. Urip Sumoharjo No., 41, Cikarang, Utara, Bekasi, , 3., , PT. Insan Sentosa Prima, Jl. KH Dewantara No. 44, Kp. Sumantri Rt. 03 / 03, Desa, Sukaraya, Kec., Karang Bahagia Kab.",Bekasi
PT. Prakarsa Sentra Utama,"Jl. Raya Sukatani Kp., Blokang, Kec., Kr., Bahagia Kab. Bekasi, , 5., , PT. Gemilang Gaisindo, Bhakti, Jl. Raya Sukatani Kp., Blokang Rt. 02 / 01 Desa, Kr. Sentosa Kec. Kr., Bahagia Kab. Bekasi",Bekasi
PT. Insan Sentosa Prima,"Jl. KH Dewantara No. 44, Kp. Sumantri Rt. 03 / 03, Desa, Sukaraya, Kec., Karang Bahagia Kab.",Lainnya
PT. Prakarsa Sentra Utama  Jl. Raya Sukatani Kp.,"Blokang, Kec., Kr., Bahagia Kab. Bekasi, , 8., , Kios Pupuk Rumpun Tani, Jl., Raya, Serang, –, Cibarusah Ds. Serang, Kec. Cikarnag Selatan, , 9.",Bekasi
PT. Meroke Tetap jaya,"Gg. VII no, 1 Segara, Makmur, tarumajaya, , 2., Pabrik Pupuk Om Benny, Kertahayu,, Setu,, Bekasi Regensi, , 3., MZ Prima Plus, Jl. Komersial BIP Ds., Blok AG, Sukadami,, Cikarang Selatan, , 4., PT. PSP(Pupuk, Langgeng Sari), Perum,, Citra, Permata, D3,no.7,, Sukadarma, Sukatani, , 5., PT., Gemilang, Gaisindo, Bhakti, ., Jl. Raya Sukatani Kp., Blokang Rt. 02 / 01, Desa Kr. Sentosa Kec., Kr., Bahagia, Kab.",Cikarang Selatan
PT. Inahovtraco,", Jl. Urip Sumoharjo No., 41, Cikarang, Utara, Bekasi, , 7., PT. Insan Sentosa Prima, Jl. KH Dewantara No., 44 Kp. Sumantri Rt. 03 /, 03 Desa Sukaraya Kec., Karang Bahagia Kab., Bekasi",Bekasi
PT. Prakarsa Sentra Utama,"Jl. Raya Sukatani Kp., Blokang, Kec., Kr., Bahagia Kab. Bekasi, , , , R A H A S I A, , , R A H A S I A, 258, , 1, 2, 3, 4, 9., PT., Gemilang, Gaisindo, Bhakti, Jl. Raya Sukatani Kp., Blokang Rt. 02 / 01, Desa Kr. Sentosa Kec., Kr. Bahagia Kab. Bekasi",Bekasi
PT. Insan Sentosa Prima,"Jl. KH Dewantara No., 44 Kp. Sumantri Rt. 03 /, 03 Desa Sukaraya Kec., Karang Bahagia Kab., Bekasi",Bekasi
PT. Prakarsa Sentra Utama  Jl. Raya Sukatani Kp.,"Blokang, Kec., Kr., Bahagia Kab. Bekasi, , , •, Gudang Pupuk, , NO, NAMA",Bekasi
PT.,"Gemilang, Gaisindo, Bhakti, ., Jl. Raya Sukatani Kp., Blokang Rt. 02 / 01, Desa Kr. Sentosa Kec., Kr., Bahagia, Kab.",Lainnya
PT. Inahovtraco,", Jl. Urip Sumoharjo No., 41, Cikarang, Utara, Bekasi, , 3, PT. Insan Sentosa Prima, Jl. KH Dewantara No., 44 Kp. Sumantri Rt. 03 /, 03 Desa Sukaraya Kec., Karang Bahagia, , 4",Bekasi
PT. Prakarsa Sentra Utama,"Jl. Raya Sukatani Kp., Blokang, Kec., Kr., Bahagia Kab. Bekasi, , 5, PT., Gemilang, Gaisindo, Bhakti, Jl. Raya Sukatani Kp., Blokang Rt. 02 / 01, Desa Kr. Sentosa Kec., Kr. Bahagia Kab. Bekasi, , 1",Bekasi
PT. Insan Sentosa Prima,"Jl. KH Dewantara No., 44 Kp. Sumantri Rt. 03 /, 03 Desa Sukaraya Kec., Karang Bahagia, , 7",Lainnya
PT. Prakarsa Sentra Utama  Jl. Raya Sukatani Kp.,"Blokang, Kec., Kr., Bahagia Kab. Bekasi, , ., , , /. J. Asosiasi ……",Bekasi
PT. Media Artha Sukses,"Sarana, Ruko Metro Boulevard Ds. Pasir, Sari Kec. Cikarang Selatan, Kab. Bekasi, , 3., , , PT. Platinium Exchang, Ruko Galeri Singaraja Blok D, No.15  Lippo Cikarang Ds., Cibatu              Kec. Cikarang, Selatan Kab. Bekasi, , , , R A H A S I A, , , R A H A S I A, 260, 1, 2, 3, 4, 4., PT. Media Artha Sukses, Sarana, Lantai, dasar, Mall, Lippo, Cikarang No.18A Ds. Cibatu, Kec. Cikarang Selatan Kab., Bekasi, , 5., Thaly Sentral Valas, Ruko Plaza Menteng Lippo, Cikarang, Ds., Cibatu, Kec, CikaranG Selatan, , 6., Royal Valuta Mas, Mall Lippo Cikarang No.18A Ds., Cibatu Kec. Cikarang Selatan, Kab. Bekasi, , 7., PT. Bintang Valas Abadi, Jl. Majapahit Ruko arkadia, Lippo Cikarang, , , c., Asosiasi Masyarakat Bidang Keuangan, , NO, NAMA, ALAMAT / NO. TLP, KET., , Nihil",Cikarang Selatan
PT. Warna Artha Life  Ruko Kalimas C.3 A-C 5 Kel. Jatimulya Kec.,"Tambun Selatan Kab.Bekasi, 101, BPR, Prima, Nusa, Tama, Jl. St. Hasanudin 76 A Ds. Setiadarma Kec., Tambun Selatan Kab.Bekasi., 102, Bank Mayapada, LT. II Pasar Tambun Ds. Setiadarma Kec., Tambun Selatan Kab.Bekasi, 103, BPR Antar Guna, Jl. Setia Darma I Desa Setia Darma Kec., Tambun Selatan Kab.Bekasi, 104, BPR Arta Prima, Ruko Sentra Niaga Kalimas  Blok B-17 Ds., Setiadarma Kec. Tambun Selatan Kab.Bekasi, 105, BPR, DPM, Kredit, Mandiri, Ruko Niaga Kalimas II Blok C-24 Ds., Setiadarma Kec. Tambun Selatan Kab.Bekasi, 106, Bank NISP, Jl. P. Diponegoro Mall Naga Ds. Setia Mekar, Ds. Setiadarma Kec. Tambun Selatan, , , R A H A S I A, , , R A H A S I A, 265, , 1, 2, 3, 107, Bank BII, Ruko Grand Wisata Blk. AA.9 No. 23 Ds., Lambangjaya Kec. Tambun Selatan Kab.Bekasi, 108, BRI, Cabang, Babelan., Jalan Raya Kebalen Kp. Kebalen RT 004 / 001, Kel. Kebalen Kecamatan Babelan, 109, BRI Cabang Pondok, Ungu Permai",Tambun
PT. HALSINDO,"Ds. Cijengkol Kec. Setu, , , 8., PUSAT PENJUALAN ONDERDIL MOTOR / MOBIL BEKAS, , NO, NAMA TEMPAT PENJUALAN, ONDERDIL",Lainnya
CV. GANESHA MOTOR,"Jl., Imam, Bonjol, Rt., 001/05 DS. Telaga Asih, Cikarang Barat, , 4., BAROKAH JAYA MOTOR",Cikarang Barat
CV BINA SUCI MOTOR,"Jl. Raya Imam Bonjol Ds., Kalijaya Kec. Cikarang, Barat, , 24, ZAHRA MOTOR, Jl. Raya Imam Bonjol Ds., Kalijaya Kec. Cikarang, Barat, , 25, RIZKY MOTOR, Jl. Raya Imam Bonjol Ds., Kalijaya Kec. Cikarang, Barat, , 26, A&Z MOTOR, Jl. Raya Imam Bonjol Ds., Kalijaya Kec. Cikarang, Barat, , 27, KARUNIA JAYA MOTOR, Jl. Raya Imam Bonjol, Cikarang Barat, , 28, CV SRI MOBILINDO MOTOR, Jl. Raya Imam Bonjol, Cikarang Barat, , 29, CV SRI MOBILINDO MOTOR2, Jl. Raya Imam Bonjol, Cikarang Barat, , 30, JUANDA MOTOR, Jl. Sultan Hasanudin No., 251 Kec. Tambun Selatan, , 31, MAJU JAYA MOTOR, Jl. Sultan Hasanudin No., 27 Kec. Tambun Selatan, , 32, EVAN PLAZA MOTOR, Jl. Sultan Hasanudin No., 39A Kec. Tambun Selatan, , 33, TARUNA JAYA MOTOR, Jl. Inspeksi Kalimalang, No. 168 Kel. Jatimulya, , 34, ANDALAS PERKASA, Jl. Sultan Hasanudin No., Kec. Tambun Selatan, , 35, MENARA ABADI MOTOR, Jl. Sultan Hasanudin Kec., Tambun Selatan, , 36, HALU BALANG MOTOR, Jl. Inspeksi Kalimalang, No. 40 Kel. Jatimulya, , 37, MANDIRI MOTOR AHMADI, Jl. KH Abubakar No. 35, Setiadarma, Tambun, Selatan, , , , R A H A S I A, , , R A H A S I A, 271, , 1, 2, 3, 4, 38, POLINKO, JAYA, SARANATAMA MOBIL, Jl. Sultan Hasanudin No., Kec. Tambun Selatan, , , 10., SENPI, HANDAK, KEMBANG API/PETASAN & PENYALAHGUNAAN SENPI/HANDAK, , a., Pengguna Senpi",Cikarang Barat
PT.,"Patria Bumi Pratama, Agung, , Kp. Jati Bumi Asih, Rt. 003 / 006 Ds., Cikarang Kota Kec., Cikarang Utara, Kab.Bekasi",Cikarang Utara
PT.,"Komala Agung, , Kp. Gempool Rt., 008/004 Ds., Sukadami Kec., Cikarang Selatan, Kab. Bekasi, Jenis",Cikarang Selatan
PT. Axiatec,", Jl. Antilop III/E 5/42, Cikarang Baru Rt., 06/07 Ds. Jayamukti, Kec. Cikarang, Pusat Kab. Bekasi",Bekasi
PT. Tirta,"Jaya Mandiri, , Kp.. Gabus Singkil, Rt. 32 Ds. Srijaya, Kec. Tambun Utara, Kab. Bekasi, Jenis, : Pistol, Model/Mer     : Glock 43, Kaliber, : 32, Peluru",Tambun
CV.,"Riksa Persada, , Grand Wisata, Festive Garden AG, Rt. 001/003 Ds., Lambangsari Kec., Tambun Selatan, Kab. Bekasi, Jenis",Tambun
CV.,"Mira Delima, , Kp. Ujung Harapan, Rt. 003 / 007 Ds., Bahagia Kec., Babelan Kab., Bekasi, Jenis",Bekasi
