Nama Perusahaan,Alamat,Kawasan/Kecamatan
PT.    Tunas Perkasa,"Indonesia, Kp. Kelapa Ds. Segara, Makmur Kec. Tarumajaya, , 5., CV. Kencana Maju Bersama, , Jl. Raya Bosih kel. Wanasari, Kec.Cibitung, , , /. Gudang ……",Cibitung
PT.,"WELLBEST, ELECTRONIC INDUSTRI, Jl.Trembesi Plot F20 No.18-, 19 Delta Silicon III Lippo, Cikarang Desa Cicau Kec., Cikarang Pusat, , 2., PT., PRAWIRA, BINTANG, SEMESTA, , Jl.Samsung 2 C Blok C.3A, Kawasan Industri Jababeka, Desa Mekarmukti, , 3., PT., MASUYA, GRAHA, TRIKENCANA, Jl.Cempaka No.12 Blok F-I, Rt.003/002 Kel. Jatimulya, Tambun Selatan, , 4., PT.",Jababeka
PT. JAGAD KARIMBANUSA,"EJIP Industrial Park Plot 9 M, Desa Sukaresmi Cikarang, Selatan, , 6., PT. ARLENE JAYAMANDIRI, Jl.Jababeka II G TOB Blok C, No.16 V Ds. Pasirgombong, Cikarang Utara, , 7., PT., WIRA, LOGITAMA, SAKSAMA, Kawasan Industri MM2100, Jl.Sumatera Blok C1 Desa, Gandasari Cikarang Barat, , 8., PT. MULTIPAR, Jl., Raya, Industri, Pasir, Gombong Blok Kramat No., 10 Ds. Pasir Gombong Kec., Cikarang Utara, , 9., PT. IRON WARE WORKS, INDONESIA, Jl. Industri Selatan Blok EE, 2G, Jababeka 2 Ds. Pasir, Sari kec. Cikarang Selatan, , 10., AJN, Jl. Industri Selatan 1 blok 3, Kawasan Industri Hyundai, Kec. Cikarang Selatan, , 11., PT., GANESHA, JAYA, MANDIRI, Jl. Industri Selatan 2 No. 19, Ds. Pasir Sari Kec. Cikarang, Selatan, , 12., PT. KAO INDONESIA, Jl. Science Boulevard Ds., Jayamukti, Kec., Cikarang, Pusat, , 13., PT. GUDANG SASA INTI, Desa, Jayamukti, Kec., Cikarang Pusat, , 14., PT., WAHANA, PRESTASI, LOGISTIK, Griya Hegar Asri Blok A2 No., 12, Ds., Hegarmukti, Kec.Cikarang Pusat, , 15., PT. AJE, Kawasan DelataSilicon III Ds., Sukamahi, Kec., Cikarang, Pusat, , , , R A H A S I A, , , R A H A S I A, 53, , 1, 2, 3, 4, 16., PT. PHILIP MORIS, Kawasan, Deltasilicon, Ds., Cicau Kec. Cikarang Pusat, , 17., PT. HAVI INDONESIA, Kawasan DeltaSilicon Ds., Cibatu Kec. Cikarang Selatan, , 18., PT. ASTRA DAIDO STEEL, INDONESIA, Kawasan, Industri, Greend, Land BloK AG No. 12 Ds., Sukamahi, Kec., Cikarang, Pusat, , 19., PT. ISEWAN INDONESIA, Kawasan GIIC Blok AA No., 26 Jl. Anggrek Raya Ds., Sukamahi, Kec., Cikarnag, Pusat, , 20., PT. SRIBOGA FLOUR MILL, Kawasan Industri Ds. Cicau, Kec. Cikarang Pusat, , 21., PT.PARIN, Kawasan Industri Ds. Cicau, Kec. Cikarang Pusat, , 22., PT., TAKATA, AITOMOTIF, SAFYTY, Kawasan Industri Ds. Cicau, Kec. Cikarang Pusat, , 23., PT. SINAR INDAH KENCANA Jl. Kenari II Ds. Cicau Kec., Cikarang Pusat, , 24., PT., SURI, NUSANTARA, JAYA, Jl. Cilangkara Ds. Sukasari, Kec. Serang Baru, , 25., PT. HERO, Jl. Gaharu No. 16 Ds. Cicau, Kec. Cikarang Pusat, , 26., PT. JF SAHABAT, Kawasan Indutri Jababeka II, Jl. Cikarang Baru Raya Ds., Jayamukti, Kec., Cikarnag, Pusat, , 27., PT. MTT, Jl. Inspeksi Kalimlang No. 14, ds. Jayamukti Kec. Cikarang, Pusat, , 28., PT., TUPPERWARE, INDONESIA, Jl. Science No. 10 Kel., Sertajaya Kec. Cikarang timur, , 29., PT., SUMBER, ALFARIA, TRIJAYA, Kawasan Industri Jababeka II, Blok PP No.6 Ds. Pasir Sari, Kec. Ciakrang Selatan, , 30., PT., INDOMARCO, PRISMATAMA, Kawasan Industri Jababeka I, BloK A No. 6-15 Ds. Pasir, Sari Kec. Cikarang Selatan, , 31., PT. MS MANDIRI, Kawasan Industri Jababeka I, BloK A No. 6-15 Ds. Pasir, Sari Kec. Cikarang Selatan, , 32., PT., INDOMARCO, PRISMATAMA, Kawasan Industri Jababeka I, BloK A No. 6-15 Ds. Pasir, Sari Kec. Cikarang Selatan, , 33., PT., INDOMARCO, PRISMATAMA, Kawasan Industri Jababeka I, BloK A No. 6-15 Ds. Pasir, Sari Kec. Cikarang Selatan, , , , R A H A S I A, , , R A H A S I A, 54, , 1, 2, 3, 4, 34., PT., INDOMARCO, PRISMATAMA, Kawasan Industri Jababeka I, BloK A No. 6-15 Ds. Pasir, Sari Kec. Cikarang Selatan, , 35., PT., INDOMARCO, PRISMATAMA, Kawasan Industri Jababeka I, BloK A No. 6-15 Ds. Pasir, Sari Kec. Cikarang Selatan, , 36., PT YCH Distrik Park, Jalan Inspeksi Kalimalang, Sukadanau, Kecamatan, Cikarang Barat, , 37., PT.  ASTER PERSISI KARYA, IND. / Capcon, Jl. Meranti II Blok L5 - 5 / D., Silicon,, Cikarang, Selatan",Jababeka
PT.  CHANDRA NUGERAH,"CEMERLANG, Jl. Akasia II Blok AE No. 25, D. Silicon, Lippo Cikarang -, Bekasi, , 39., PT.  CHO LONG MOTOR, PARTS INDONESIA, , Jl. Meranti I Blok L2 No. 5 & 6, / D. Silicon I, Cikarang, Selatan - Bekasi, , 40., PT.  GSK INDUSTRIAL",Bekasi
PT.  ICHANG HYDRAULIC,"HARDWARE IND ., , , Jl, Angsana I Blok A5 - 1 / D., Silicon, Cikarang Selatan –, Bekasi, , 42.",Cikarang Selatan
PT.  KWANG HWA SHING,"INDUSTRIAL, , KI. Delta Silicon Blok L7 No., 6 - 10, Cikarang Selatan –, Bekasi, , 43., PT.  PREMIER INDUSTRY",Delta Silicon
PT.,", SAN, CHING, INDONESIA, , Jl. Kruing II / KI. D. Silicon I, Blok L7 -  02, Cikarang, Selatan – Bekasi, , 45.",Bekasi
PT.  SAN TSEN DAI,", Jl. Meranti I Blok L2 No. 3 D., Silicon, Lippo Cikarang –, Bekasi, , 46., PT.",Bekasi
PT.,", THREE, STAR, INDONESIA, BIIE Hyundai Blok C2 No. 3A, Cikarang Bekasi, , 48., PT.  ASTRA HONDA MOTOR, , KI., MM2100 Blok AA  No. 1, Cikarang Barat – Bekasi, , 49., PT.  BHAKTI",MM2100
PT.  ASTRA HONDA MOTOR,", , KI. MM2100 Blok AA  No. 1, Cikarang Barat – Bekasi, , 51., PT.  BHAKTI, KI. MM2100",MM2100
PT.  DENSO INDONESIA,"CORP, , , Jl. Kalimantan  Blok E1-2, MM2100 Cibitung, , , , 53., PT.  FEDERAL NITTAN, INDUST., , , KI MM2100 Blok F No. 4, Cikarang Barat - Bekasi, , , 54., PT.  FILTECH INDONESIA, , , , , KI. MM2100 Blok JJ No. 3 - 1, Cikarang Barat - Bekasi, , 55., PT.  ICHIKOH INDONESIA, , , , KI. MM2100 Blok LL No. 1, Cikarang Barat - Bekasi, , 56., PT.  KAYABA INDONESIA, , , , Jl. Jawa Blok II/4 Cibitung,, Cikarang Barat - Bekasi, , 57., PT.  LIPPO MELCO AUTO",MM2100
PT.  MORIC INDONESIA,", , KI. MM2100 Blok KK No. 2-3-, 4 Cikarang Barat – Bekasi, , 59., PT.  NUSA TOYOTETSU, CORP",MM2100
PT.  PROGRESS TOYO IND,", , KI. MM2100 Blok  H4 No. 3, Cibitung, , 61., PT.  SEIWA INDONESIA, , , KI. MM2100 Blok M2 No. 2, Cikarang Barat – Bekasi, , 62., PT.  SEKISO INDUSTRIES, IND.",MM2100
PT.  SUGITY CREATIIVES,", , , MM2100 Industrial Town Blok, J18 Cibitung – Bekasi, , 64., PT.",MM2100
PT.,", YUTAKA, MANUFAKTURING, IND, KI. MM2100 Jl., Sulawesi I Blok H4 Cikarang, Barat – Bekasi, , 66., PT.  DUTA LASERINDO, METAL",MM2100
PT.,", HIT, ELECTRONIC, INDONESIA, , Jl. Kruing II Blok L9 - 9,10 / D., Silicon, Cikarang Selatan –, Bekasi, , 68.",Cikarang Selatan
PT.,", HITACHI, CHEMICAL.EL.PROD.IND, , , Jl. Palem II Blok DS - 12 / B., Techno, Cikarang Selatan –, Bekasi, , 69.",Cikarang Selatan
PT.  INDONESIA NISSIN,"KHOKI, Delta Silicon, Jl.Meranti 3 L8-6A Cikarang, Selatan, , 70., PT., , TOYOLAS, TECHNOLOGY INDONESIA, , , Jl. Trembesi/ KI. Delta Silicon, II  Blok F5 No. 9, Cikarang, Pusat – Bekasi",Delta Silicon
PT.,", YONG, HWA, INDONESIA, , Jl. Akasia III Blok A6 - 7 / D., Silicon, Cikarang Selatan –, Bekasi, , 72.",Cikarang Selatan
PT.,", DAESUNG, ELECTRONIC, INDOENSIA, , , KI. BIIE. Hyundai Blok C2 No., 10 Lemahabang, , 73., PT.  GALVA KAMI INDUSTRI, , , KI. BIIE. Hyundai Blok C No., 5-6, Cikarang, Selatan, –, Bekasi, , 74., PT.",Bekasi
PT.,", SHIN, HEUNG, INDONESIA, , KI. Hyundai Blok C3 No. 1, Lemahabang, , 76., PT.  WHA IN, Jl. Inti III Blok C6 No. 10, Cikarang Selatan – Bekasi, , 77., PT.  BANDO ELEKTRONIK, IND.",Cikarang Selatan
PT.,", DONGYANG, ELECTRONIC, IND., KI. MM2100 Blok, I No. 2-3 Cibitung, , 79., PT.  HAENGSUNG RAYA, INDUSTRIAL, , Jl. Sumbawa / KI. MM2100, Blok F1 No. 2, Cikarang Barat, – Bekasi, , 80.",MM2100
PT.  INS TECHNOLOGY,"INDONESIA, , KI. MM2100 Blok G, Cikarang, Barat – Bekasi, , 81., PT., MANDIRI",MM2100
PT.,"CIKARANG, NUSANTARA, Jl. Patikarna wangunharja,, Cikarang Utara, Kab. Bekasi, , 83., CV., MENEMBUS, BATAS, LANGIT, , Jl., Pamahan, simpangan,, Cikarang Utara, Kab. Bekasi, , 84., BERKAH LANGGENG JAYA, , , Kp. Cibuntu asem No. 73,, Cibuntu,, Cibitung,, Kab., Bekasi, , 85., PT. ANSORI JAYA, , Jl. Raya Ciantra, Cikarang, Selatan, Kab. Bekasi, , 86., PT. HAROSA DN, , Jl., Jayamukti,, Cikarang, Pusat, Kab. Bekasi, , 87., PT. CHOLYFOUR MITRA, MANDIRI, , Jl., Raya, Citarik, lama,, Cikarang Utara, Kab. Bekasi, , 88., PT. RUSLY JAGAT UTAMA, , , Jl., Jayamukti,, Cikarang, Pusat, Kab. Bekasi, , 89., PT., KOMALA, AGUNG, LANGGENG, , Jl., Raya-Serang, setu,, Cikarang, selatan,, Kab., Bekasi, , 90., PT. PUTRA SELANG JAYA, , , Jl. Bosih raya No. 161,, Wanasari,, Cibitung,, Kab., Bekasi, , , , R A H A S I A, , , R A H A S I A, 57, , 1, 2, 3, 4, 91., PT. SINAR AGUNG KREASI, , , Jl. Raya serang, Cikarang, selatan, Kab. Bekasi, , 92., PT. HORAS MIDUK, , Jl. Inspeksi Kalimalang, Pasir, sari, Cikarang Selatan, Kab., Bekasi, , 93., CV BAROKAH, Jl. Bah kilong, Sukasari,, Serang baru, Kab. Bekasi, , 94., PT., SEGARA, WAJA, SEJAHTERA, , Jl., Jatiwangi,, Jatiwangi,, Cikarang Barat, Kab. Bekasi, , , , f., Perdagangan Jasa, , NO, NAMA, ALAMAT / NO. TLP., KET., 1, 2, 3",Cikarang Barat
PT.,"AUSDOC, GEOSERVICES, INDONESIA, Jl. Industri Utara I Blok, SS 12,13,15 Cikarang, Utara - Bekasi, Jasa, Pengelolaan, Arsip, 2., PT.AWANA PLASINDO  Jl. Pisangan Ds. Satria, Jaya - Tambun - Bekasi, Jasa untuk bungkus, elektronik, 3., PT.BAKRI DIA, ENGINEERING, KI. MM2100 Blok D No. 1, Cibitung, Jasa Kontruksi, 4., PT BUSFIMAC INDO, JL. JABABEKA II BLOK C, III B, Jasa Pergudangan, 5., PT CAHAYA PRIMA, SENTOSA, Jl. Inti Raya / KI. BIIE., Hyundai Blok C1 - 19,, Cikarang, Jasa, Ekspor",Jababeka
PT,"CAHAYATIARA, MUSTIKA SCIENTIFIC, INDONESIA, Jl. Jababeka IXB Blok, P6H Cikarang Utara -, Bekasi, Jasa Ekspor dan, Impor alat - alat, kimia, dan, laboratorium, 7., PT.CASCO PERSADA, INDONESIA, Jl. Industri Utara I Blok, SS No. 18 Cikarang Utara, - Bekasi, Jasa, Industri, Perekat Impor &, Ekspor, 8., PT CRESTEC, GARUDA GRAPHIC, INDONESIA, KI. MM2100  Blok N2, Cibitung, Cikarang Barat -, Bekasi, Jasa Film Cetak, 9., PT FIRST AND SMILE, (FNS) LOGISTIC, KI. MM2100 Blok M No., 31, Cikarang Barat -, Bekasi, Jasa, Transportasi, Barang, 10., PT.FRITTA, INDONESIA, Jl. Jababeka IV Blok T, No. 5A Cikarang, Jasa, Konsultasi, Teknik, 11., PT.GLOBAL PATNERS, LOGUSTICS, Jl. Jababeka XVIIH Blok, U-21J, Cikarang Utara -, Bekasi, Jasa, eksport, &, import, serta, pergudangan, 12., PT.GRAND DINAMIKA, Jl. Akasia I Blok A1 No. 5, Lemahabang, Jasa Furniture, , , R A H A S I A, , , R A H A S I A, 58, , 1, 2, 3, 4, 13., PT HANSE ABADI, Jl. Gunung Patuha no. 82, Lippo Cikarang Selatan -, Bekasi, Jasa Eksport dan, Import, 14., AO Transport, Lippo, Cikarang, Ds., Sukaresmi, Transportasi, 15., TIKI, Kp. Leuwemalang Ds., Sukaresmi, Jasa antar barang, 16., Rosalia Indah, Kp., Tegalgede, Ds., Pasirsari, Transportasi, dan, jasa antar barang, 17., DHL, Kp. Leuwemalang Ds., Sukaresmi, Gudang paket, 18., ONO Trans, Perum viila Mutiara Ds., Ciantra, Transportasi, 19., PT.  JAVA PRIMA, GLOBAL, , , , , , Jl. Niaga Utara Blok CC 1, - 2 Cikarang Utara –, Bekasi",Jababeka
PT.  INDOMOBIL,"FINANCE INDONESIA, , Jl. Yos Sudarso / Ruko, Cikarang Plaza Blok C 6,, Cikarang Pusat – Bekasi, Jasa asuransi, kendaraan",Bekasi
PT.  CIKARANG ASRI,"TEHNIK UTAMA, , KI. Jababeka II Blok C, No. 11G-H Cikarang, , Jasa Bengkel Las, , , 22., CV.  RAMA MIWONDI, , , Jl. Kancil V Blok C No., 53, Cikarang Baru -, Bekasi, Jasa Boga, , , 23., PT.  DAFIO SERVICE, INDUSTRY, Jl. Puspa IIIA No. 21,, Cikarang Baru - Bekasi, Jasa Boga (, Catering Service), 24., PT.  INDOCATER, , , Jl. Jababeka V Kav 4-6,, Cikarang - Bekasi, Jasa Boga, (Catering), , 25., PT.  SARIPANGAN, MULIASUTIDJA, , , Jl. Jababeka IIG Blok CC, No. 3, Cikarang Utara -, Bekasi, , Jasa Boga /, Catering, , , 26.",Jababeka
PT.  SAPTA BUANA,"(CV)., , Jl. Jabebeka IX No. 66, Cikarang Utara - Bekasi, Jasa Borongan, , , 27., PT.  MEGA UTAMA CV., , Jl.Untung Suropati Pasir, Gombong Bekasi, Jasa Catering, , , , , R A H A S I A, , , R A H A S I A, 59, , 1, 2, 3, 4, 28., PT.  RLC INDONESIA, , , KI. Jababeka XVII B, Block U - 20 Cikarang, Utara - Bekasi, Jasa Ekspor &, Impor, , , 29., PT.  TIMEXA, INTERNUSA  PT, Jl. Arief Rachman Hakim I, Cikarang, Jasa Ekspor dan, Impor, 30., PT.  CAHAYATIARA, MUSTIKA SCIENTIFIC, INDONESIA, , Jl. Jababeka IXB Blok, P6H Cikarang Utara –, Bekasi, , , Jasa Ekspor dan",Jababeka
PT.  GLOBAL,"PATNERS LOGUSTICS, , Jl. Jababeka XVIIH Blok, U-21J, Cikarang Utara -, Bekasi, Jasa eksport &, import serta, pergudangan, , 32., PT.  SYSTEM, ENGINEERING, INTEGRATOR, INDONESIA, , Jl. Industri Selatan II Blok, JJ - 3, Cikarang Utara –, Bekasi, , , Jasa Engineering &",Jababeka
PT.  ADYAWINSA,"DINAMIKA, Jl. Jababeka IV SFP Blok, V No. 81 B Cikarang, Jasa Industri, , 34., PT.  MIRAE, INTERNATIONAL, , Jl. Jababeka II Blok J,, Cikarang Utara – Bekasi, , Jasa Industri alat -, alat pengangkat, dan transpor",Jababeka
PT.  CASCO PERSADA,"INDONESIA, , Jl. Industri Utara I Blok, SS No. 18 Cikarang Utara, - Bekasi, Jasa Industri, Perekat Impor &, Ekspor, 36., PT.  TAMI UTAMA, CATERING CV, , Jl. Merak V No. 121 Blok, I1, Cikarang Baru -, Bekasi, Jasa katering / jasa, boga, , 37., PT.  LINFOX LOGISTIC",Cikarang Utara
PT.,", Jl. Jababeka II Blok C9 -, 10, Cikarang Utara –, Bekasi, Jasa Konsultan dan, Managemen, Logistik",Jababeka
PT.  SANKO GOSEI,"TECHNOLOGY, INDONESIA, , Jl. Jababeka XIIB Blokk, W No. 17 - 20 Cikarang, Utara – Bekasi, Jasa Konsultasi, manajemen, dibidang barang -, barang dari plastik",Jababeka
PT.  FRITTA,"INDONESIA, Jl. Jababeka IV Blok T, No. 5A Cikarang, Jasa Konsultasi, Teknik, 40., PT.  MURINDA IRON, STEEL, Jl. Raya Pasir Gombong, Km. 2 Cikarang Utara -, Bekasi, Jasa Kontruksi, , , 41., PT.  DECORIENT, INDONESIA, Jl. Jababeka V  Blok 46, Cikarang, Jasa Kontruksi, , , , R A H A S I A, , , R A H A S I A, 60, , 1, 2, 3, 4, 42., PT.  ASAHI GLASS, MACHINERY INDO, , , , KI.  Jababeka Blok J II, No. 1 Cikarang, , , , Jasa Kontruksi &, Pelaksanaan, Bidang Sipil,, mekanikal dan, elektronik, 43., PT.  KENINDO, KENCANA PT., , Ruko Harco Cikarang, Blok G No. 8, Cikarang, Utara - Bekasi, Jasa Kontruksi, Sipil, Mekanikal &, Elektronika, 44., PT.  CIKARANG, LISTERINDO, KI. Jababeka Blok R, Cikarang, Jasa Listrik, , 45., PT.  CATUR, MANDRARAKSA, MANDIRI, Jl. Industri Selatan I Blok, OO No. 4A Cikarang, Utara Bekasi, Jasa Mekanikal, , , 46., PT.  MITRA KARYA, MANDIRI, Jl. Puma 8 No. 65, Perumahan Cikarang, Baru - Bekasi, Jasa Pelatihan dan, Penyalur Tenaga, Kerja, 47., PT.  GOBER SETATA, PATI, Jl. Mulia Glass, tegal, Gede - Cikarang Utara -, Bekasi, Jasa pembersih, , , 48., PT.  JASA TURBO, WAHANA, Jl. Jababeka XI Blok K, No. 5H Cikarang, Jasa Pemeliharaan, Peralatan Pabrik /, Mesin, 49., PT.  PERDANA, FILTER8 INDONESIA",Jababeka
PT.  YAYASAN PEND.,"PELITA HARAPAN, Jl. Dago Permai No. 1, Lemahabang, Jasa Pendidikan, , 51., PT.  AUSDOC, GEOSERVICES, INDONESIA, Jl. Industri Utara I Blok, SS 12,13,15 Cikarang, Utara - Beksi, Jasa Pengelolaan, Arsip, , 52., PT.  DONGWOO, ENVIRONMENTAL, IND., Jl. Jababeka IX Blok P -, 3F Cikarang, , Jasa Pengolahan, Limbah, 53., PT.  BIROTIKA, SEMESTA, Jl. Jababeka IXA Blok P, No. B-02 Cikarang Utara, – Bekasi, jasa Penitipan, barang (cargo), , 54.",Jababeka
CV.  TAIYOU MANDIRI,", Cluster, Darmawangsa, Grand, Residen, Rt.002/011, Desa, Cijengkol, Kec.Setu",Lainnya
CV.,"PRO, MITRA, INDONESIA, Jl., Kancil, 1/B/122, Cikarang Baru Rt.002/007, Kel.Sertajaya, Kec., Cikarang Timur",Cikarang Timur
PT. ARTHA,"Jl. Beruang Raya H No., 169, , 18., CV. WIRA KARYA T, Jl. Beruang Raya H No., 173 - G 190, , 19., CV. GLOBAL MULTI T, Jl. Beruang Raya H No., 175, , 20., PT. TAMBOR, Jl. Beruang Raya H No., 177 - H 182, , 21., CV. AQRU TEKHNIK, Jl. Beruang Raya H No., 181, , 22., INDOSEHAT, Jl. Beruang Raya H 185, , 23., MEGAKARYA, Jl. Beruang Raya H 203, , 24., PROLOG, Jl. Beruang Raya H 205, , 25., INNOVATECH, Jl. Beruang Raya H 207, , 26., WIRATAMA, Jl. Beruang Raya H 109-, 211-G195, , 27., OWIEN, Jl. Beruang Raya H 213, , 28., CV. ASBARU, Jl. Beruang Raya G No., 214, , 29., PT. DERIS TAMA, Jl. Beruang Raya G No., 208-207-206, , 30., PT. BANDRO ENGINERING, YOSVIN ARIES, Jl. Beruang Raya G No., 200, , 31., CV. RAMA TECH, Jl. Beruang Raya G No., 196, , 32., CV. DUTA PRATAMA, Jl. Beruang Raya G No., 186, , 33., CV., CIPTA, KARYA, MANDIRI, Jl. Beruang Raya G No., 212, , 34., PT. KAKAZU INDO, Jl. Beruang Raya G No., 182, , 35., CV. SARI PLASINDO, Jl. Beruang Raya G No., 160-178, , 36., PT. FAKO KARYA, Jl. Beruang Raya G No., 178, , 37., CV. PANDAWA, Jl. Beruang Raya G No., 111, , 38., CV. ERA MAKMUR, Jl. Beruang Raya G No., 172, , 39., CV. UNIVERSAL. P, Jl. Beruang Raya G No., 170, , 40., CV. DST, Jl. Beruang Raya G No., 168, , , , R A H A S I A, , , R A H A S I A, 63, , 1, 2, 3, 4, 41., AQUALIA, Jl. Beruang Raya G No., 164, , 42., PT. JAYA SENTRA ENG, Jl. Beruang Raya G No., 191, , 43., ISI PERSADA, Jl. Beruang Raya G No., 185, , 44., Cv. Wahana Cipta / Bubut, Kp Kandang Roda Rt 05/03, Ds. Serang Kec. Ciksel, , 45.",Lainnya
PT. JABABEKA,"Desa Pasirgombong Kec., Cikarang, Utara, Kab., Bekasi., , 19., PT. MATTEL, Desa Pasirgombong Kec., Cikarang, Utara, Kab., Bekasi., , 20., PT. KMK PLASTIK, INDONESIA, Kec. Cikarang Utara Kab., Bekasi., , 21., PT. LUTI COCO ABADI, Desa Pasirgombong Kec., Cikarang, Utara, Kab., Bekasi., , 22., PT. ASIA PRINTIS CD, Desa Pasirgombong Kec., Cikarang, Utara, Kab., Bekasi., , 23., PT. SEPANJANG SURYA, GAS, Kec. Cikarang Utara Kab., Bekasi., , 24., PT. ASTANA IMI INDS., LEMAH ABANG, Desa Pasirgombong Kec., Cikarang, Utara, Kab., Bekasi., , 25., PT. DARMA KARSA UTAMA Kec. Cikarang Utara Kab., Bekasi., , 26., PT. ICI SUTARTECKS, INDONESIA, Kec. Cikarang Utara Kab., Bekasi., , , , R A H A S I A, , , R A H A S I A, 67, , 1, 2, 3, 4, 27., YAYASAN BIDAYATUS, SABIL, Desa Cikarangkota Kec., Cikarang, Utara, Kab., Bekasi., , 28., PT. SINAR BOGASARI, , , , 29., PT. DAELIM DARMALA, INDONESIA, Desa Karangraharja Kec., Cikarang, Utara, Kab., Bekasi., , 30., PT. CIKARANG LISTRINDO, Desa Karangraharja Kec., Cikarang, Utara, Kab., Bekasi., , 31., PT. SHOWA INDONESIA, MFG, Desa, Harjamekar, Kec., Cikarang, Utara, Kab., Bekasi., , 32., PT. BOGASARI PUTRA, INDONESIA, Desa Cikarangkota Kec., Cikarang, Utara, Kab., Bekasi., , 33., PT. APERI INDONESIA, Kec. Cikarang Utara Kab., Bekasi., , 34., PT. UNIFAK KEMAS INDAH, Desa Karangraharja Kec., Cikarang, Utara, Kab., Bekasi., , 35., PT. GRAFINDO MAQTRA, SEMESTA, Desa, Harjamekar, Kec., Cikarang, Utara, Kab., Bekasi., , 36., PT. TOSO, Desa Pasirgombong Kec., Cikarang, Utara, Kab., Bekasi., , 37., PT. BINKO MARAHMANA, Desa Pasirgombong Kec., Cikarang, Utara, Kab., Bekasi., , 38., PT. MAHCTRACO, “KOPKAR MATRA”, Desa, Karangasih, Kec., Cikarang",Cikarang Utara
PT. SARA CHOOME,"PERSADA, Desa Cikarangkota Kec., Cikarang, Utara, Kab., Bekasi., , 45., MIK CIKARANG, Desa Cikarangkota Kec., Cikarang Utara Kab., Bekasi., , 46., CV. WIJAYA CIKARANG, MOTOR, Desa Cikarangkota Kec., Cikarang Utara Kab., Bekasi., , 47., NKO MAS LESTARI, Desa, Harjamekar, Kec., Cikarang, Utara, Kab., Bekasi., , 48., PT. PADI COMPONEN, “LLATE”, Desa Pasirgombong Kec., Cikarang, Utara, Kab.",Cikarang Utara
PT. KOPKARCO,"Desa Harjamekar Kec., Cikarang Utara Kab., Bekasi., , 51., PT. NISSIN MAS, Desa Pasirgombong Kec., Cikarang, Utara, Kab., Bekasi., , 52., PASAR BARU CIKARANG, Desa Cikarangkota Kec., Cikarang, Utara, Kab., Bekasi., , 53., PASAR LEMAH ABANG, Desa, Waluya, Kec., Cikarang, Utara, Kab., Bekasi., , 54., KARTIKA MAKMUR JAYA, Desa, Mekarmukti, Kec., Cikarang, Utara, Kab., Bekasi., , 55., JASA PERD. UM., ANUGRAH SRI REJEKI, Desa Karangraharja Kec., Cikarang, Utara, Kab., Bekasi., , , 56., DISTRIBUSI SEMBAKO, MELATI (KDS), Desa, Karangasih, Kec., Cikarang, Utara, Kab., Bekasi., , 57., PERD. ANEKA JASA, WARGA SEJAHTERA, Desa Pasirgombong Kec., Cikarang, Utara, Kab., Bekasi., , 58., WARGA PERUM. CKR., BARU USAHA JAYA, Desa, Mekarmukti, Kec., Cikarang, Utara, Kab., Bekasi., , , , R A H A S I A, , , R A H A S I A, 69, , 1, 2, 3, 4, 59., PERISAI BHAGASASI, “KOPER”, Desa Karangasih Kec., Cikarang Utara Kab., Bekasi.",Cikarang Utara
PT. CHANG CHUN,"CHEMICAL, Desa, Harjamekar, Kec., Cikarang, Utara, Kab., Bekasi., , 72., PERDAG. UMUM & JASA, RKN SEJAHTERA, Desa, Tanjungsari, Kec., Cikarang, Utara, Kab., Bekasi., , 73., CV. ANUGERAH, SEJAHTERA, Desa, Mekarmukti, Kec., Cikarang, Utara, Kab., Bekasi., , 74., KOP. KAR WOTSILA, INDONESIA, Desa, Harjamekar, Kec., Cikarang, Utara, Kab., Bekasi., , , , R A H A S I A, , , R A H A S I A, 70, , 1, 2, 3, 4, 75., PT. KOTI, Desa Pasirgombong Kec., Cikarang, Utara, Kab., Bekasi., , 76., KOP SIMP. PINJAM MITRA, SEJAHTERA, Desa, Tanjungsari, Kec., Cikarang, Utara, Kab., Bekasi., , 77., PT. DINO, Desa Pasirgombong Kec., Cikarang, Utara, Kab., Bekasi., , 78., KOPONTREN DANIL, HIKMAH, Desa, Sukaraja, Kec., Karang, Bahagia, Kab., Bekasi., , 79., KOP. CITRA MANDIRI, Desa, Sukaraya, Kec., Karang, Bahagia, Kab., Bekasi., , 80., PERTANIAN MERKAH, JAYA, Desa, Karangsetia, Kec., Karang, Bahagia, Kab., Bekasi., , 81., USAHA BERSAMA HAI 94, Desa, Sukaraya, Kec., Karang Bahagia Bks, , 82., PER. ANEKA JASA WAHID, JAYA, Desa Karangrahayu Kec., Karang, Bahagia, Kab., Bekasi., , 83., PERTANIAN ALAM, SEJAHTERA ABADI, Desa, Sukaraya, Kec., Karang, Bahagia, Kab., Bekasi., , 84., \, BAHAGIA KARYA MANDIRI, Desa Karangbahagia Kec., Karang, Bahagia",Bekasi
CV. Saqinah Mandiri Catering,"Perum Permata Cikarang Selatan, Blok D1 No. 08 Rt.04/15 Ds., Sukadami Kec. Cikarang Selatan, Kab.Bekasi, 3., Buana Catering",Cikarang Selatan
CV. Cempaka Katering,"Jl.  Raya Setu Perum Grand, Mutiara Gading Roxi No. A 19 Ds., Telajung Kec. Cikarang Barat, 5., CV.Embun vitadana, Perumahan Taman Sentosa Blok, H3 No.02 Rt.020/007 Ds. Pasir, Sari Kec. Cikarang Selatan, 6., PT. Alam Handal Makmur, Kav. Blok B1 N0. 60-63 Ds.",Cikarang Barat
CV. Mitra Prima Sarana,"Perumahan Taman Sentosa Blok, H4 No.01 Rt.020/007 Ds. Pasir, Sari Kec. CikaranG Selatan",Cikarang Selatan
CV. Sabana,"Jl. Kedasih XI Blok XI Blok G No., 121 Rt.03/08 Cikarang Baru Kec., Cikarang Utara, 9., CV. Mulia Mandiri, Kp. Kukun Rt.11/06 Ds. Ciantra",Cikarang Utara
PT. Sinar Cipta Bogatama,"Perumnas Bumi Teluk Jambe W,, Jl. Kresna Kav. 73, 12., CV. Larasati, Jl. Ciherang Timur IV B/HH/20, Rt.03/09 Ds. Simpangan Kec., Cikarang Timur, 13., CV. Surya Padang Gambir Sawit",Cikarang Timur
PT. Asri Indo Rasa,"Jl. Cilemahabang Raya T-1 No.8, Cikarang Baru Rt.03/09 Ds., Jayamukti Kec. Cikarang Pusat, 15., CV. Caria Mandiri, Perum Mega Regency Blok",Lainnya
CV. Merdeka Catering,"Perumahan Kartika Wanasari Blok, B-1 no.5 Rt.02/11 Kel. Wanasari, Kec. Cibitung, 17., CV. Reva Putri, Kp. Cikedokan Rt.02/10 Ds.",Cibitung
CV. Berkah Bumi Baru,"Perum Mutiara Bekasi Jaya Blok, K.8 No.12 Rt.004/008 Ds. Sindang, Jaya Kec. Cibarusah, 21., PT. kurnia Catering, Kp. Babakan Rt.001/001 Ds.",Bekasi
CV. Adela,"Kp. Walahir Rt.01/05 Ds. Waluya, Kec. Cikarang Utara, 23., CV. Ryan Boga Utama catering, Jl. Merak Blok G No.1 Rt.03/08",Cikarang Utara
PT. Sho Chan,"Jababeka IV D No. 82 Ds. PAsir, Gombong Kec. Cikarang Utara, 25., Sahid Catering Service, Jl. MH. Thamrin Kav. 103 lippo, Cikarang Kec. Cikarang Selatan, 26., Kana Ratu Catering, Jl. Kancil V/D no.60 Rt.04/07 Ds., Sertajaya Kec. Cikarang Timur, 27., CV. Karunia Catering, Kp. Cibereum Ds. Mekarmukti",Jababeka
CV. Nur cipta Boga Catering,"Perum Taman Aster Blok G/7, No.21-22 Kec. Cikarang Barat, 29., PT. Lucky Print Abadi, Jl. Warung Bongkok Ds.",Cikarang Barat
CV. Mitra Mandiri,"Kp. Rawa Lintah rt.001/001 Ds., Mekar Mukti Kec. Cikarang Utara, 31., CV. Pribumi Karya Mandiri, Kawasan Industri MM2100 Kp.",MM2100
CV. Rizqullah Catering,"Kp. Kukun rt.10/05 Ds. Ciantra, Kec. Cikarang Selatan, 33., CV. Delicia Catering, Kp. Jarakosta No.01 Rt. 05/02",Cikarang Selatan
CV. Serumpun Padi,"Kp. Jarakosta Rt.001/002 Ds., Danau Indah Kec. Cikarang Barat, 37., CV. Makmur Sejati, Jl. Teratai Raya No. 124 Rt.03/01",Cikarang Barat
CV. Usaha Bersama,"Kp. Cikedokan warungsengon, Rt.02/01 No.140 Ds. Sukadanau, Kec. Cikarang Barat, 39., CV. Andika Pratama, Ruko Sentra Niaga Square Jl.",Cikarang Barat
PT. Cipta Niaga Cemerlang,"Jl. Gemalapik No. 57 Ds. Pasir, Sari Kec. Cikarang Selatan, 42., CV. Zhavira Bersaudara catering, Perum Kota Serang Baru Blok D-, 08 No.09 Rt. 08/016 ds., Sukaragam Kec. Serang Baru, 43., UD. Wulandari Sukses, Kp. Rawa JulanG Rt.04/02 Ds.",Cikarang Selatan
CV. Mitra Prima Sarana,"Perumahan Taman Sentosa Blok, H.4 No.01 Rt.020/007 Ds. Pasir, Sari KEc. Cikarang Selatan, 47., PT. Nuansa Mitra Nusantara, Jl. Raya Setu Kp. Telajung No.178",Cikarang Selatan
CV. Maju Catering,"Kp. Kukun Rt.002/005 Ds. Ciantra, Kec.Cikarang Selatan",Cikarang Selatan
CV. Manna Glory Pratama,"Ruko Ventura Jl. Gunung, Panderman Blok E No.01 Lc Ds., Cibatu Kec. Cikarang Selatan, 51., Saung Aira, Belakang Woom Finance, Cikarang Kp. Tanah Baru, Rt.002/002 Kec. Cikarang Utara, 52., Warung Tegal Mba Ning, Kp. Darmajaya Rt.003/02 Ds., Setiadarma KEc. Tambun Selatan",Cikarang Utara
PT. Melatindo Surya Perkasa,"Kp. Kukun Ds. Ciantra Rt.11/06, Kec.Cikarang Selatan, 57., PT. Ratu Mandiri, Jl. Kedasih 9 Blok F1 / 140 PErum",Cikarang Selatan
PT ASIANA WANG ANIMATION,"Lippo Cikarang Desa, Cibuntu Kec. Cikarang, Selatan, , 2., PT.CRESTEC INDONESIA, KI. MM2100, Jl. Lombok, I Blok. N2. Cikarang, , 3., PT.DAWEE PRINTING, INDONESIA, Jl. Jababeka IV Blok, C2F Cikarang, , 4., PT. TEMPRINA, Kp. Setiadarma Desa, Setiadarma, Kec., Tambun Selatan Kab., Bekasi, , 5., CV. NUSA AGUNG, Kp., Legon, Kel., Jatimulya Kec. Tambun, Selatan Kab. Bekasi, , 6., PT. TEMPRINA, Kp. Setiadarma Desa, Setiadarma, Kec., Tambun Selatan Kab., Bekasi, , , , R A H A S I A, , , R A H A S I A, 81, , 1, 2, 3, 4, 7., PERCETAKAN NANA, Rt. 07/03 Ds., Cikarageman Kec. Setu, , 8., AHMAD PILAR",Jababeka
CV. Harta Jaya,"Rt. 01/04 Ds. Wanasari, Kec. Cibitung, , 12., Rido Ilahi",Cibitung
